title,text,score,subject,predicate,object,label
Occhi dalle stelle,"La stessa sorte tocca alla modella che si era messa alla ricerca del fotografo scomparso, e che verrà successivamente ritrovata in stato di shock.",1.6666667,La stessa sorte,tocca a,la modella,0
Max Unger,"Il 26 dicembre 2012, Unger fu convocato per il primo Pro Bowl in carriera e il 12 gennaio 2013 fu inserito nel First-team All-Pro.",2.0,il 12 gennaio 2013,fu inserito in,il First-,0
Vojska protivovozdušnoj oborony SSSR,"Negli anni tra le due guerre, per l'Unione Sovietica diventò un problema sentito quello di dotare le truppe di armi e attrezzature militari adeguate.",1.75,per l' Unione Sovietica,diventò,un problema,0
Vincenza Pasini,"La seconda apparizione sarebbe avvenuta due anni dopo, il 1º agosto 1428.",1.6666667,La seconda apparizione,sarebbe avvenuta,due anni,0
Lake Koast,"Risale al gennaio 2003 presso gli studi di Radio Deejay l'incontro con il notissimo disc jockey e produttore di fama internazionale Mario Fargetta, un'amicizia che nell'estate 2004 diventa collaborazione per il singolo ""Play This Song"".",1.25,in l' estate 2004,diventa,collaborazione per il singolo,0
Blake Ritson,"[...] unito al gazoo forma una combinazione vincente"".",1.3333334,a il gazoo,forma,una combinazione vincente,0
László Kubala,"Mentre il campionato prendeva il via continuarono incessanti le pressioni sulla Federazione ungherese ed alla FIFA, ma non si avevano risposte.",1.5714285,il via,continuarono,incessanti le pressioni su la Federazione ungherese,0
Mira (Italia),La località aveva assunto i connotati di un importante,1.4,La località,aveva assunto,i connotati di un importante,0
Florida Beach Dogs,"Nel Dakota meridionale rimasero per 9 anni, conquistando il terzo titolo CBA e raggiungendo i play-off in 8 stagioni su 9.",1.75,In il Dakota meridionale,rimasero per,9 anni,0
Stefano Garuti,"La stagione seguente ha allenato il Sangimignano, in Serie D.",2.1666667,La stagione seguente,ha allenato,il Sangimignano,0
Chewingum (film),"ma all'aula scolastica preferiscono il bar ""Chewingum"" all'aperto, dove, oltre ad ammirare il Colosseo, di fronte al quale si trova la scuola, possono scommettere sulla marca della prima macchina in arrivo.",1.5,a l' aula scolastica,preferiscono,il bar,0
Provincia di Brescia (Lombardo-Veneto),"All'atto dell'istituzione, la provincia fu divisa in diciassette distretti, a loro volta suddivisi in trenta comuni:",1.6666667,a loro volta,suddivisi in,trenta comuni,0
Trattato sulla natura umana,"lo percepisco in modo sfocato rispetto alla impressione precedente; questa situazione indica per Hume l'esistenza dell'idea, come ricordo sbiadito di una vivace impressione non più attuale.",1.8333334,questa situazione,indica per,Hume l' esistenza di l' idea,0
Mikel Nieve,"In febbraio conclude al quarto posto la Vuelta a Andalucía, corsa a tappe vinta dal suo capitano Chris Froome.",1.8571429,In febbraio,conclude a,il quarto posto la Vuelta a Andalucía,0
Dar es Salaam,"La parte nord di Dar es Salaam costituisce il distretto di Kinondoni, dove si trovano alcune delle aree residenziali più esclusive; Oyster Bay, che era la zona dove prima dell'indipendenza risiedevano i coloni britannici, è una delle più sviluppate.",1.3333334,di l' indipendenza,risiedevano,i coloni britannici,0
Operazione Market Garden,"Gli Stati Maggiori a Washington, inoltre, premevano con insistenza per utilizzare offensivamente e in modo audace anche le ingenti forze aviotrasportate disponibili, accuratamente addestrate e organizzate; la pianificazione operativa rimaneva ancora confusa (durante i mesi di luglio e agosto numerose operazioni delle truppe aviotrasportate erano state in un primo tempo studiate per poi essere annullate, di fronte agli sviluppi delle operazioni), tuttavia sia il Capo di Stato Maggiore dell'Esercito statunitense, generale George Marshall, sia il comandante delle United States Army Air Forces, generale Henry Arnold, facevano pressioni sul comandante supremo delle forze di spedizione alleate in Europa, generale Dwight Eisenhower, affinché si sfruttasse la situazione e si organizzasse l'impiego anche di queste truppe scelte.",1.2380953,agosto numerose operazioni di le truppe aviotrasportate,erano state in,un primo tempo,0
Clitennestra (Pizzetti),"Sette anni dopo Clitennestra viene a sua volta uccisa dal proprio figlio Oreste, che era stato allontanato da bambino e torna in incognito (portando la falsa notizia della propria morte) per vendicare il padre.",2.0,Sette anni dopo Clitennestra,viene a,sua volta,0
Ramones,"Ackerman ha indicato come Joey sia stato l'ideatore di una rivoluzione musicale e culturale, nonché un pioniere del punk rock.",6.0,Ackerman,ha indicato come,Joey,0
Marco Antonio,L'assemblea senatoria non accolse le loro provocazioni ma al contempo annullò le decisioni più importanti del console e lo destituì da ogni incarico per l'anno seguente.,1.6666667,a il contempo,annullò,le decisioni,0
Rock 'n' Roll Damnation,"Il brano compare nell'album dal vivo ""If You Want Blood You've Got It"" del 1978, e nella colonna Sonora di ""Iron Man 2"".",4.7,If You Want Blood You',ve,Got It,0